{
  "schema_version": 1,
  "id": "dedup_weak_fiat_shamir_minimal_draft",
  "status": "draft",
  "source": "adversarial",
  "api": "verify_cell_kzg_proof_batch",
  "family": "duplicateCommitments",
  "bug_class": "dedupWeakFiatShamir",
  "invariants": [
    "challengeCanonicality",
    "uniqueCommitmentBinding"
  ],
  "summary": "Historical draft case for the deduplicated-commitment challenge bug fixed in c-kzg-4844 v2.1.5. The intended witness shape is a cell batch whose commitments conceptually look like [A, A, B], so the challenge must bind both unique commitments rather than hashing only the first two original positions.",
  "input": {
    "fixture_strategy": "external_regression_fixture",
    "conceptual_commitments": [
      "A",
      "A",
      "B"
    ],
    "commitment_count": 3,
    "unique_commitment_count": 2,
    "duplicate_commitment_positions": [
      0,
      1
    ],
    "distinct_commitment_positions": [
      2
    ],
    "ffi_replay_target": "verify_cell_kzg_proof_batch",
    "fixture_target": "consensus-specs regression test added for the verify_cell_kzg_proof_batch bug"
  },
  "expected": {
    "normalization": {
      "result": "ok"
    },
    "decision": "reject"
  },
  "tag_matrix": {
    "v2.1.2": {
      "expected_replay": "pass",
      "reason": "Current repo taxonomy does not mark this tag as the affected historical failure for duplicate commitments."
    },
    "v2.1.3": {
      "expected_replay": "pass",
      "reason": "Current repo taxonomy does not mark this tag as the affected historical failure for duplicate commitments."
    },
    "v2.1.4": {
      "expected_replay": "fail",
      "reason": "The historical bug used the deduplicated commitment count with the original commitments array, so not all unique commitments were bound into the challenge."
    },
    "v2.1.5": {
      "expected_replay": "pass",
      "reason": "v2.1.5 explicitly fixes the deduplicated-commitment challenge construction bug."
    }
  },
  "notes": [
    "The final replayable bytes are still pending. This draft exists to pin the bug class, witness shape, and tag expectations before the FFI harness lands.",
    "The expected reject decision is an inference from the upstream bug description: a correct implementation should not accept the malformed or weakly bound proof batch."
  ],
  "references": [
    "https://github.com/ethereum/c-kzg-4844/releases/tag/v2.1.5",
    "https://github.com/ethereum/c-kzg-4844/pull/607",
    "https://github.com/ethereum/consensus-specs/releases/tag/v1.6.0-beta.0"
  ]
}
